{
  "schema": "F02_KNOWN_FAMILY_BATCH_MANIFEST_V1",
  "mode": "MANUAL_SUPERVISED_INGEST",
  "batch_id": "F02_REAL_PROVEN_2026_JAN_MAY_REFERENCE",
  "batch_kind": "LOCAL_ONLY",
  "reference_period": {
    "start": "2026-01-01",
    "end": "2026-05-31"
  },
  "sources": [
    {
      "source_id": "F02_FUNDEB_LOCAL_2026_JAN_MAY",
      "family": "FUNDEB_LOCAL",
      "role": "LOCAL_MONITORING_NO_RREO_PERIOD_MATCH",
      "drive_file_id": "1vtXPMSg94m2j9Bbss0bHLhAyJo_LWVxK",
      "expected_sha256": "751704be95e98a908dea23468edd16948cdffc5e5453f31baff0edc71fb3f93f",
      "expected_bytes": 21579,
      "expected_pages": 3,
      "snapshot_path": "runtime/f02/2026_jan_may/FUNDEB_TRANSPARENTE_2026_POS_31-05.pdf"
    },
    {
      "source_id": "F02_MDE25_LOCAL_2026_JAN_MAY",
      "family": "MDE_25_LOCAL",
      "role": "AUXILIARY_LOCAL_MONITORING_NO_RREO_SUBSTITUTION",
      "drive_file_id": "1_rUUrjo19x9NlYueu3VyRcYN95sqbJpG",
      "expected_sha256": "1fe6539f146469fb5f2b98168e68c80290f62f47b6f531eb525e767aa26211b0",
      "expected_bytes": 18954,
      "expected_pages": 1,
      "snapshot_path": "runtime/f02/2026_jan_may/MDE_25PCT_2026_POS_31-05.pdf"
    }
  ],
  "remote_effects_authorized": {
    "bronze_write": false,
    "silver_write": false,
    "gold_write": false,
    "serving": false,
    "publication": false,
    "site": false,
    "overwrite": false,
    "delete": false,
    "move": false,
    "schedule": false,
    "recurrence": false
  }
}
